<?xml version="1.0" encoding="UTF-8"?>
<xsd:schema xmlns:xsd="http://www.w3.org/2000/10/XMLSchema" xmlns:od="urn:schemas-microsoft-com:officedata">
<xsd:element name="dataroot">
<xsd:complexType>
<xsd:choice maxOccurs="unbounded">
<xsd:element ref="tblKlubbar"/>
</xsd:choice>
</xsd:complexType>
</xsd:element>
<xsd:element name="tblKlubbar">
<xsd:annotation>
<xsd:appinfo>
<od:index index-name="PrimaryKey" index-key="Klubbnr " primary="yes" unique="yes" clustered="no"/>
<od:index index-name="Namn" index-key="Namn " primary="no" unique="no" clustered="no"/>
</xsd:appinfo>
</xsd:annotation>
<xsd:complexType>
<xsd:sequence>
<xsd:element name="Klubbnr" minOccurs="0" od:jetType="integer" od:sqlSType="smallint" type="xsd:short"/>
<xsd:element name="Namn" minOccurs="0" od:jetType="text" od:sqlSType="nvarchar">
<xsd:simpleType>
<xsd:restriction base="xsd:string">
<xsd:maxLength value="50"/>
</xsd:restriction>
</xsd:simpleType>
</xsd:element>
</xsd:sequence>
</xsd:complexType>
</xsd:element>
</xsd:schema>
